{
  "$schema": "https://veritymodchecker.online/data/verity-releases.schema.json",
  "schemaVersion": 2,
  "checkedAt": "2026-07-28T15:54:00+08:00",
  "canonicalUrl": "https://veritymodchecker.online/download/",
  "method": "Manual comparison against linked maintainer project pages, exact file records, and official public project APIs. Download totals are point-in-time popularity signals, not safety verdicts.",
  "projects": [
    {
      "name": "Verity JE",
      "edition": "Java",
      "owner": "VarmiteYT",
      "projectId": 1591438,
      "projectUrl": "https://www.curseforge.com/minecraft/mc-mods/verity-je",
      "status": "current",
      "projectDownloadsAtCheck": 2262441,
      "projectDownloadsApproximate": false,
      "verifiedAlternateSources": [
        {
          "host": "Modrinth",
          "owner": "Varmite",
          "projectId": "on1Y0osD",
          "projectUrl": "https://modrinth.com/mod/verity-je-official",
          "status": "current",
          "relationshipEvidence": "The project description calls Verity JE an official adaptation created with ThatMob's permission, and the project team lists ThatMob as Creator / Inventor.",
          "projectDownloadsAtCheck": 296665,
          "projectDownloadsApproximate": false,
          "releases": [
            {
              "status": "beta",
              "filename": "verity-6.0.0.jar",
              "recordId": "5ech0sTo",
              "recordUrl": "https://modrinth.com/mod/verity-je-official/version/6.0.0-beta",
              "downloadUrl": "https://cdn.modrinth.com/data/on1Y0osD/versions/5ech0sTo/verity-6.0.0.jar",
              "minecraftVersion": "1.20.1",
              "loader": "Forge",
              "packageType": "jar",
              "displayedSizeMb": 235.11,
              "sizeBytes": 246535597,
              "recordDownloadsAtCheck": 6753,
              "publishedDate": "2026-07-27",
              "versionType": "beta",
              "hashes": {
                "sha1": "87f39573ea29e796ad856d96fd056b8dfe0043d9",
                "sha512": "c8b282be27ab4a0f19da6e834c4ee70602cef98bb5a81fe848932c1ca0edd98c41904602fe02b357d0a65265fba352860df6e06da669de6404143a224ce40afb"
              }
            },
            {
              "status": "stable-current",
              "filename": "verity-5.7.3.jar",
              "recordId": "yAt0wv1Z",
              "recordUrl": "https://modrinth.com/mod/verity-je-official/version/5.7.3",
              "downloadUrl": "https://cdn.modrinth.com/data/on1Y0osD/versions/yAt0wv1Z/verity-5.7.3.jar",
              "minecraftVersion": "1.20.1",
              "loader": "Forge",
              "packageType": "jar",
              "displayedSizeMb": 235.06,
              "sizeBytes": 246481139,
              "recordDownloadsAtCheck": 239408,
              "publishedDate": "2026-07-18",
              "hashes": {
                "sha1": "da28115bbad0478d9ed9c97f2466b67d46d13d51",
                "sha512": "15cd8d895788f4859ecf442b7a970c8bca3b30db99aa170639b5f003a18b0f0255bdf5b042eb95a686ac51ecec80afbfeb766654c3471f5cc890664982cd9c81"
              }
            }
          ]
        }
      ],
      "releases": [
        {
          "status": "current",
          "filename": "verity-5.7.3.jar",
          "recordId": 8461257,
          "recordUrl": "https://www.curseforge.com/minecraft/mc-mods/verity-je/files/8461257",
          "minecraftVersion": "1.20.1",
          "loader": "Forge",
          "packageType": "jar",
          "displayedSizeMb": 235.1,
          "recordDownloadsAtCheck": 582300,
          "recordDownloadsApproximate": true,
          "publishedDate": "2026-07-18"
        },
        {
          "status": "deprecated-buggy",
          "filename": "verity-3.4.1.jar",
          "recordId": 8346795,
          "recordUrl": "https://www.curseforge.com/minecraft/mc-mods/verity-je/files/8346795",
          "minecraftVersion": "1.21.1",
          "loader": "NeoForge",
          "packageType": "jar",
          "displayedSizeMb": 156,
          "recordDownloadsAtCheck": 269800,
          "recordDownloadsApproximate": true,
          "publishedDate": "2026-06-30",
          "maven": "curse.maven:verity-je-1591438:8346795"
        }
      ]
    },
    {
      "name": "Verity BE",
      "edition": "Bedrock",
      "owner": "Undertaletalelover",
      "projectId": 1574632,
      "projectUrl": "https://www.curseforge.com/minecraft-bedrock/addons/verity-be",
      "status": "current",
      "projectDownloadsAtCheck": 3934799,
      "projectDownloadsApproximate": false,
      "releases": [
        {
          "status": "current",
          "filename": "Verity (Stable) (1.1.0)-(26.3).mcaddon",
          "aliases": [
            "Verity (Stable) (1.1.0)-(26.3#).mcaddon"
          ],
          "recordId": 8506198,
          "recordUrl": "https://www.curseforge.com/minecraft-bedrock/addons/verity-be/files/8506198",
          "minecraftVersion": "26.30",
          "loader": null,
          "packageType": "mcaddon",
          "displayedSizeMb": 21.3,
          "recordDownloadsAtCheck": 137000,
          "recordDownloadsApproximate": true,
          "publishedDate": "2026-07-25"
        }
      ]
    },
    {
      "name": "Verity - Bedrock Edition",
      "edition": "Bedrock",
      "owner": "PnTMC",
      "projectId": 1575941,
      "projectUrl": "https://www.curseforge.com/minecraft-bedrock/addons/verity-bedrock-edition",
      "status": "current",
      "projectDownloadsAtCheck": 7137557,
      "projectDownloadsApproximate": false,
      "releases": [
        {
          "status": "current",
          "filename": "ThatMob's Verity 3.2.0 by PnTMC [Add-on] - V26.30.mcaddon",
          "recordId": 8517480,
          "recordUrl": "https://www.curseforge.com/minecraft-bedrock/addons/verity-bedrock-edition/files/8517480",
          "minecraftVersion": "26.30",
          "loader": null,
          "packageType": "mcaddon",
          "displayedSizeMb": 39.6,
          "recordDownloadsAtCheck": 119500,
          "recordDownloadsApproximate": true,
          "publishedDate": "2026-07-27",
          "changelogSummary": [
            "fixed 9 bugs",
            "upgrade throw system (sneak + drop = throw)",
            "upgrade AI"
          ]
        },
        {
          "status": "current-version-other-bedrock-build",
          "filename": "ThatMob's Verity 3.2.0 by PnTMC [Add-on] - V26.20.mcaddon",
          "recordId": 8517478,
          "recordUrl": "https://www.curseforge.com/minecraft-bedrock/addons/verity-bedrock-edition/files/8517478",
          "minecraftVersion": "26.20",
          "loader": null,
          "packageType": "mcaddon",
          "displayedSizeMb": 39.6,
          "recordDownloadsAtCheck": 11300,
          "recordDownloadsApproximate": true,
          "publishedDate": "2026-07-27",
          "note": "CurseForge file list showed this current 3.2.0 V26.20 row and download route /8517478 on July 27, 2026; use the exact file page when opening the final download."
        },
        {
          "status": "current-version-other-bedrock-build",
          "filename": "ThatMob's Verity 3.2.0 by PnTMC [Add-on] - V26.10.mcaddon",
          "recordId": 8517473,
          "recordUrl": "https://www.curseforge.com/minecraft-bedrock/addons/verity-bedrock-edition/files/8517473",
          "minecraftVersion": "26.13+",
          "loader": null,
          "packageType": "mcaddon",
          "displayedSizeMb": 39.6,
          "recordDownloadsAtCheck": 9800,
          "recordDownloadsApproximate": true,
          "publishedDate": "2026-07-27",
          "note": "CurseForge file list showed the V26.10 row under 26.13 plus three additional supported builds and download route /8517473 on July 27, 2026."
        },
        {
          "status": "previous-still-available",
          "filename": "ThatMob's Verity 3.1.0 by PnTMC [Add-on] - V26.30.mcaddon",
          "recordId": 8503821,
          "recordUrl": "https://www.curseforge.com/minecraft-bedrock/addons/verity-bedrock-edition/files/8503821",
          "minecraftVersion": "26.30",
          "loader": null,
          "packageType": "mcaddon",
          "displayedSizeMb": 39.7,
          "recordDownloadsAtCheck": 246300,
          "recordDownloadsApproximate": true,
          "publishedDate": "2026-07-25"
        },
        {
          "status": "previous-still-available",
          "filename": "ThatMob's Verity 2.1.0 by PnTMC [Add-on] - V26.30.mcaddon",
          "recordId": 8327253,
          "recordUrl": "https://www.curseforge.com/minecraft-bedrock/addons/verity-bedrock-edition/files/8327253",
          "minecraftVersion": "26.30",
          "loader": null,
          "packageType": "mcaddon",
          "displayedSizeMb": 35.4,
          "recordDownloadsAtCheck": 2900000,
          "recordDownloadsApproximate": true,
          "publishedDate": "2026-06-27",
          "changelogSummary": [
            "edit CHASE animations",
            "reduce lag",
            "remove or reduce a feature for better experience"
          ]
        },
        {
          "status": "previous-still-available",
          "filename": "ThatMob's Verity 2.1.0 by PnTMC [Add-on] - V26.20.mcaddon",
          "recordId": 8327250,
          "recordUrl": "https://www.curseforge.com/minecraft-bedrock/addons/verity-bedrock-edition/files/8327250",
          "minecraftVersion": "26.20",
          "loader": null,
          "packageType": "mcaddon",
          "displayedSizeMb": 35.4,
          "recordDownloadsAtCheck": 294900,
          "recordDownloadsApproximate": true,
          "publishedDate": "2026-06-27",
          "changelogSummary": [
            "edit CHASE animations",
            "reduce lag",
            "remove or reduce a feature for better experience"
          ]
        },
        {
          "status": "previous-still-available",
          "filename": "ThatMob's Verity 2.1.0 by PnTMC [Add-on] - V26.10.mcaddon",
          "recordId": 8327242,